{
  "$schema": "urn:fortress:schema:v1:behavioral-flow-graph",
  "schema_version": 1,
  "semantic_version": "1.0.0",
  "project_id": "PF-FORTRESS",
  "standard": {
    "id": "STD-FORTRESS-ENGINEERING",
    "edition": "1.0.0-draft.2"
  },
  "source_ccg_digest": "sha256:926494f4045758cac2d9481cb46dcabaaa014be3c56400ca579a77b1534dd6c8",
  "view": "intended",
  "summary": {
    "total_features": 22,
    "modeled_features": 1,
    "unmodeled_features": 21,
    "coherent_features": 1,
    "incoherent_features": 0,
    "checkpoints": 10,
    "edges": 9,
    "decisions": 1,
    "terminals": 2,
    "participant_modules": 6,
    "boundary_crossings": 8,
    "loops": 0
  },
  "feature_states": [
    {
      "feature": "AF-AFFECTED-ANALYSIS-0001",
      "owner": "AF-AFFECTED-ANALYSIS-0001",
      "state": "UNMODELED"
    },
    {
      "feature": "AF-ARCHITECTURE-EVALUATION-0001",
      "owner": "AF-ARCHITECTURE-EVALUATION-0001",
      "state": "UNMODELED"
    },
    {
      "feature": "AF-BEHAVIORAL-REALIZATION-0001",
      "owner": "AF-BEHAVIORAL-REALIZATION-0001",
      "state": "UNMODELED"
    },
    {
      "feature": "AF-BEHAVIORAL-SEMANTICS-0001",
      "owner": "AF-BEHAVIORAL-SEMANTICS-0001",
      "state": "UNMODELED"
    },
    {
      "feature": "AF-BOOTSTRAP-GOVERNANCE-0001",
      "owner": "PF-FORTRESS",
      "state": "UNMODELED"
    },
    {
      "feature": "AF-CERTIFICATION-0001",
      "owner": "AF-CERTIFICATION-0001",
      "state": "UNMODELED"
    },
    {
      "feature": "AF-CONTRACT-COHERENCY-0001",
      "owner": "AF-CONTRACT-COHERENCY-0001",
      "state": "UNMODELED"
    },
    {
      "feature": "AF-ENVIRONMENTAL-SEMANTICS-0001",
      "owner": "AF-ENVIRONMENTAL-SEMANTICS-0001",
      "state": "UNMODELED"
    },
    {
      "feature": "AF-FINDING-MODEL-0001",
      "owner": "AF-FINDING-MODEL-0001",
      "state": "UNMODELED"
    },
    {
      "feature": "AF-FORTRESS-AUDIT-0001",
      "owner": "PF-FORTRESS",
      "state": "MODELED_COHERENT"
    },
    {
      "feature": "AF-IMPLEMENTATION-OBSERVATION-0001",
      "owner": "AF-IMPLEMENTATION-OBSERVATION-0001",
      "state": "UNMODELED"
    },
    {
      "feature": "AF-INFORMATION-FLOW-0001",
      "owner": "AF-INFORMATION-FLOW-0001",
      "state": "UNMODELED"
    },
    {
      "feature": "AF-PROGRAM-SEMANTICS-0001",
      "owner": "AF-PROGRAM-SEMANTICS-0001",
      "state": "UNMODELED"
    },
    {
      "feature": "AF-PROJECT-MODEL-0001",
      "owner": "AF-PROJECT-MODEL-0001",
      "state": "UNMODELED"
    },
    {
      "feature": "AF-REFERENCE-RESOLUTION-0001",
      "owner": "AF-REFERENCE-RESOLUTION-0001",
      "state": "UNMODELED"
    },
    {
      "feature": "AF-REPOSITORY-OBSERVATION-0001",
      "owner": "AF-REPOSITORY-OBSERVATION-0001",
      "state": "UNMODELED"
    },
    {
      "feature": "AF-SEMANTIC-ANALYSIS-0001",
      "owner": "AF-SEMANTIC-ANALYSIS-0001",
      "state": "UNMODELED"
    },
    {
      "feature": "AF-SNAPSHOT-GOVERNANCE-0001",
      "owner": "AF-SNAPSHOT-GOVERNANCE-0001",
      "state": "UNMODELED"
    },
    {
      "feature": "AF-SOURCE-ARCHITECTURE-0001",
      "owner": "AF-SOURCE-ARCHITECTURE-0001",
      "state": "UNMODELED"
    },
    {
      "feature": "AF-STANDARD-REGISTRY-0001",
      "owner": "AF-STANDARD-REGISTRY-0001",
      "state": "UNMODELED"
    },
    {
      "feature": "AF-STATE-EFFECT-ANALYSIS-0001",
      "owner": "AF-STATE-EFFECT-ANALYSIS-0001",
      "state": "UNMODELED"
    },
    {
      "feature": "TF-CLI-0001",
      "owner": "TF-CLI-0001",
      "state": "UNMODELED"
    }
  ],
  "flows": [
    {
      "feature": "AF-FORTRESS-AUDIT-0001",
      "owner": "PF-FORTRESS",
      "state": "MODELED_COHERENT",
      "participating_modules": [
        "AF-ARCHITECTURE-EVALUATION-0001",
        "AF-CONTRACT-COHERENCY-0001",
        "AF-IMPLEMENTATION-OBSERVATION-0001",
        "AF-SNAPSHOT-GOVERNANCE-0001",
        "PF-FORTRESS",
        "TF-CLI-0001"
      ],
      "trigger_checkpoint": "CHK-AUDIT-REQUESTED",
      "terminal_checkpoints": [
        "CHK-AUDIT-FAILED",
        "CHK-AUDIT-PASSED"
      ],
      "nodes": [
        {
          "checkpoint": "CHK-ARCHITECTURE-EVALUATED",
          "module": "AF-ARCHITECTURE-EVALUATION-0001",
          "kind": "action",
          "terminal_outcome": null,
          "provenance": {
            "path": "engine/architecture_evaluation/contract.json",
            "pointer": "/behavior/0"
          }
        },
        {
          "checkpoint": "CHK-AUDIT-FAILED",
          "module": "TF-CLI-0001",
          "kind": "terminal",
          "terminal_outcome": "fail",
          "provenance": {
            "path": "cli/contract.json",
            "pointer": "/behavior/0"
          }
        },
        {
          "checkpoint": "CHK-AUDIT-INTERPRETED",
          "module": "TF-CLI-0001",
          "kind": "action",
          "terminal_outcome": null,
          "provenance": {
            "path": "cli/contract.json",
            "pointer": "/behavior/1"
          }
        },
        {
          "checkpoint": "CHK-AUDIT-PASSED",
          "module": "TF-CLI-0001",
          "kind": "terminal",
          "terminal_outcome": "pass",
          "provenance": {
            "path": "cli/contract.json",
            "pointer": "/behavior/2"
          }
        },
        {
          "checkpoint": "CHK-AUDIT-REQUESTED",
          "module": "PF-FORTRESS",
          "kind": "trigger",
          "terminal_outcome": null,
          "provenance": {
            "path": "contract.json",
            "pointer": "/behavior/0"
          }
        },
        {
          "checkpoint": "CHK-AUDIT-RESULT-CLASSIFIED",
          "module": "AF-SNAPSHOT-GOVERNANCE-0001",
          "kind": "decision",
          "terminal_outcome": null,
          "provenance": {
            "path": "engine/snapshot_governance/contract.json",
            "pointer": "/behavior/0"
          }
        },
        {
          "checkpoint": "CHK-CONTRACT-ECOSYSTEM-COMPILED",
          "module": "AF-CONTRACT-COHERENCY-0001",
          "kind": "action",
          "terminal_outcome": null,
          "provenance": {
            "path": "engine/contract_coherency/contract.json",
            "pointer": "/behavior/0"
          }
        },
        {
          "checkpoint": "CHK-IMPLEMENTATION-OBSERVED",
          "module": "AF-IMPLEMENTATION-OBSERVATION-0001",
          "kind": "action",
          "terminal_outcome": null,
          "provenance": {
            "path": "engine/implementation_observation/contract.json",
            "pointer": "/behavior/0"
          }
        },
        {
          "checkpoint": "CHK-REPOSITORY-STABILIZED",
          "module": "AF-SNAPSHOT-GOVERNANCE-0001",
          "kind": "action",
          "terminal_outcome": null,
          "provenance": {
            "path": "engine/snapshot_governance/contract.json",
            "pointer": "/behavior/1"
          }
        },
        {
          "checkpoint": "CHK-RULES-EVALUATED",
          "module": "AF-SNAPSHOT-GOVERNANCE-0001",
          "kind": "action",
          "terminal_outcome": null,
          "provenance": {
            "path": "engine/snapshot_governance/contract.json",
            "pointer": "/behavior/2"
          }
        }
      ],
      "edges": [
        {
          "source": "CHK-ARCHITECTURE-EVALUATED",
          "target": "CHK-RULES-EVALUATED",
          "decision_outcome": null,
          "crosses_module_boundary": true,
          "provenance": {
            "path": "engine/architecture_evaluation/contract.json",
            "pointer": "/behavior/0/transitions/0"
          }
        },
        {
          "source": "CHK-AUDIT-INTERPRETED",
          "target": "CHK-REPOSITORY-STABILIZED",
          "decision_outcome": null,
          "crosses_module_boundary": true,
          "provenance": {
            "path": "cli/contract.json",
            "pointer": "/behavior/1/transitions/0"
          }
        },
        {
          "source": "CHK-AUDIT-REQUESTED",
          "target": "CHK-AUDIT-INTERPRETED",
          "decision_outcome": null,
          "crosses_module_boundary": true,
          "provenance": {
            "path": "contract.json",
            "pointer": "/behavior/0/transitions/0"
          }
        },
        {
          "source": "CHK-AUDIT-RESULT-CLASSIFIED",
          "target": "CHK-AUDIT-FAILED",
          "decision_outcome": "fail",
          "crosses_module_boundary": true,
          "provenance": {
            "path": "engine/snapshot_governance/contract.json",
            "pointer": "/behavior/0/transitions/0"
          }
        },
        {
          "source": "CHK-AUDIT-RESULT-CLASSIFIED",
          "target": "CHK-AUDIT-PASSED",
          "decision_outcome": "pass",
          "crosses_module_boundary": true,
          "provenance": {
            "path": "engine/snapshot_governance/contract.json",
            "pointer": "/behavior/0/transitions/1"
          }
        },
        {
          "source": "CHK-CONTRACT-ECOSYSTEM-COMPILED",
          "target": "CHK-IMPLEMENTATION-OBSERVED",
          "decision_outcome": null,
          "crosses_module_boundary": true,
          "provenance": {
            "path": "engine/contract_coherency/contract.json",
            "pointer": "/behavior/0/transitions/0"
          }
        },
        {
          "source": "CHK-IMPLEMENTATION-OBSERVED",
          "target": "CHK-ARCHITECTURE-EVALUATED",
          "decision_outcome": null,
          "crosses_module_boundary": true,
          "provenance": {
            "path": "engine/implementation_observation/contract.json",
            "pointer": "/behavior/0/transitions/0"
          }
        },
        {
          "source": "CHK-REPOSITORY-STABILIZED",
          "target": "CHK-CONTRACT-ECOSYSTEM-COMPILED",
          "decision_outcome": null,
          "crosses_module_boundary": true,
          "provenance": {
            "path": "engine/snapshot_governance/contract.json",